ФИО,Желаемая должность,Зарплата,Личная информация,Местоположение,Занятость и график,Общий опыт,Последнее место работы,Обязанности,Ключевые навыки,Обо мне,Образование,Языки,Ссылка
Кандидат,Backend Разработчик C#,Не указано,"Мужчина, 24 года","Томск , не готов к переезду , готов к редким командировкам",Не указано,Опыт не указан,Не указано,Не указано,"C#, ООП, SQL, SQLite, MS Visual Studio, СУБД, Visual Studio C#, .NET Framework, SOLID, Рефакторинг кода, Модульное тестирование, .NET Core, Разработка ПО, Архитектурные паттерны, LINQ, Русский — Родной, Английский — B2 — Средне-продвинутый",В последние годы проходил обучение без возможности работать.,"Томский государственный университет систем управления и радиоэлектроники, Томск безопасности , Комплексное обеспечение информационной безопасности автоматизированных систем; ГБНОУ ""ГМЛИ"" Физико-математичекий","Русский — Родной, Английский — B2 — Средне-продвинутый",https://hh.ru/resume/4a69eaa50005847dc10039ed1f72717376694a
Кандидат,Программист C#,Не указано,"Мужчина, Не указано","Казань , не готов к переезду , не готов к командировкам",Не указано,Опыт не указан,Не указано,Не указано,"Visual Studio C#, Java, Русский — Родной","На данный момент являюсь студентом. Реального опыта работы не было, однако знаю базовые навыки программирования по С# и Java. Помогал разрабатывать игру на С#(платформа Unity). Разрабатывал приложения на Java для андроида(платформа Android Studio). Знаком с такими языками, как HTML, JS, CSS, PHP,SQL Есть опыт в создании сайта","Казанский национальный исследовательский технический университет им. А.Н. Туполева, Казань Институт компьютерных технологии и защиты информации , Программная инженерия",Русский — Родной,https://hh.ru/resume/c8edc4bb00087522d60039ed1f573363586b4a
Кандидат,Программист с#,40 000 ₽ на руки,"Мужчина, 45 лет","Таганрог , готов к переезду (Таганрогский) , не готов к командировкам",Не указано,Опыт работы 22 года 1 месяц,Ведущий программист в ООО Научно Производственная Компания Бюро кадастра г. Таганрога,"Техническая поддержка сотрудников организации. Разработка и модернизация плагинов для ARCGIS и QGIS на языках C# и paython для автоматизации работы сотрудников. Разработка и сопровождение системы регистрации обращений сотрудников предприятия в отдел технической поддержки. Разработка и администрирование баз данных. (SQL Server, PostgrSQL) Участие с разработке геоинформационного портала на Node Js, javascript, jquery. Разработка сервиса для загрузки картографических данных в геоинформационные системы из XML - файлов на dotnet 5.","Ответственность, Русский — Родной, Английский — A1 — Начальный","Прокладка сетей, установка и настройка операционных систем и программного обеспечения, сопровождение работы офисной техники. Разработка баз данных в MS SQL Server и Access. Разработка СУБД MS SQL Server и Access на С#","Таганрогский Радиотехнический Университет Радиотехнический факультет. Радиоэлектронные системы , инженер; Организация и технология защиты информации Московская Академия Комплексной Безопасности Предпринимательства (филиал на базе Таганрогского Радиотехнического Университета) , менеджер по инженерно-техническим средствам защиты информации и объектов","Русский — Родной, Английский — A1 — Начальный",https://hh.ru/resume/e650f0ba0000b112350039ed1f736563726574
Кандидат,Программист C#,40 000 ₽ на руки,"Мужчина, 46 лет","Нижний Новгород , готов к переезду , готов к редким командировкам",Не указано,Опыт работы 18 лет 9 месяцев,Разработчик ПО для биржевого трейдинга в Фриланс,"Разработка ТЗ и ПО на основе него для индикаторов и торговых роботов для платформы NinjaTrader, Quik и других Разработка standalone приложений для трейдинга","Русский — Родной, Английский — B2 — Средне-продвинутый","Разработка ТЗ и программных продутков на его основе Английский на уровне чтения тех.документации. Отличное владение MS Visual Studio, NinjaTrader 7 Коммуникабельность Обучаемость","Нижегородский Государственный Технический Университет факультет информационных систем, инженер-приборостроитель , нет","Русский — Родной, Английский — B2 — Средне-продвинутый",https://hh.ru/resume/c47003ed000129924f0039ed1f4638306a6537
Кандидат,Программист C#,30 000 ₽ на руки,"Женщина, 41 год","Краснодар , готова к переезду (Москва, Санкт-Петербург) , не готова к командировкам",Не указано,Опыт работы 8 лет 9 месяцев,Инженер в «ИнтелТелеком»,"- Продажа, внедрение и настройка продуктов компании в Южном Федеральном Округе - После сдачи локального экзамена стал сертифицированным инженером компании С чем приходилось работать: - сетевых протоколы прикладного уровня - настройка сетевого оборудования (роутеры, модемы, gsm-шлюзы) - администрирование PostgreSQL, FireBird, SQL-запросы разной сложности - написание собственных плагинов на языке программирования C#, расширение функционала основной программы - работа с сервером телефонии (Infinity Contact Center) - поиск багов программы (логические, программные) - работа с коммуникационными оборудованием, настройка голосовых IVR-сценариев, биллингом - Написание отчетов (SQL)","Visual Studio C#, MS Visual Studio, Базы данных, SQL Server, Cистемы управления базами данных, Настройка сетевых подключений, PostgreSQL, FirebirdSQL, C#, VMware, Настройка DNS, TCP/IP, VoIP, Администрирование серверов, Администрирование, Администрирование ДМС, Администрирование приема, перевода и увольнения сотрудников, Обучение и развитие, Настройка ПК, MS Office, Windows, Работа в команде, Active Directory, SP, CRM, Infinity, Должностные инструкции, Ответственность, Исполнительность, Русский — Родной, Английский — A1 — Начальный","В работе обладаю такими качествами как: - Аккуратность - Ответственность - Способность к быстрому обучению - Порядочность - Упорство - Аналитические способности - Способность решать любые поставленные задачи качественно и в срок - Продуктивность - Амбициозность У меня большое желание развиваться и получать профессиональный опыт в программировании и в работе с базами данных. Хотелось бы попасть в коллектив, где цели компании амбициозные, а задачи нетривиальные. Достойная заработная плата, конечно, хорошо, но опыт в данном случае для меня имеет первостепенную ценность.","Кубанский государственный аграрный университет, Краснодар Экономический , ЭКОНОМИКА И УПРАВЛЕНИЕ; C# Essential CyberBionic Systematics , Программирование; C# Starter CyberBionic Systematics , Программирование","Русский — Родной, Английский — A1 — Начальный",https://hh.ru/resume/1ca0d5b000037f74470039ed1f4f49704d6954
Кандидат,Программист C#,18 000 ₽ на руки,"Мужчина, 30 лет","Санкт-Петербург , м. Чёрная речка , не готов к переезду , не готов к командировкам",Не указано,Опыт не указан,Не указано,Не указано,Английский — B2 — Средне-продвинутый,"Опыт разработки на C#, знание языков C/C++(под Windows), Java. Знание ООП. Базовые знания SQL.",СПбГЭТУ &quot;ЛЭТИ&quot; -- Санкт-Петербургский государственный электротехнический университет &quot;ЛЭТИ&quot;; СПГЭУ ФКТИ Программная инженерия,Английский — B2 — Средне-продвинутый,https://hh.ru/resume/aeac292700049235780039ed1f64796e577549
Кандидат,Unity Developer,Не указано,"Мужчина, 33 года","Санкт-Петербург , м. Ладожская , хочу переехать , готов к командировкам",Не указано,Опыт работы 8 лет 2 месяца,Lead Unity Developer в ООО Робиклаб,"Создание игр/симуляторов лабораторий для школьного образования под WebGL. Дизайн сцен, настройка света, разработка игровых механик, построение архитектуры, публикация, поддержка. Работа с Addressables, Zenject, Unitask, Dotween, CineMachine. Руководство небольшой командой.","Unity, C#, Android, Microsoft Visual Studio, Visual Studio C#, iOS, Творческое мышление, ООП, Git, SOLID, Adobe Photoshop, Английский язык, Zenject, Dotween, Game Programming, VR, MS Visual Studio, Design Patterns, MVC, Unity 3D, AR, Паттерны проектирования, DI, Mvp, Ecs, MVVM, Умение работать в команде, Рефакторинг кода, Умение разбираться в чужом коде, Addressables, Русский — Родной, Английский — B2 — Средне-продвинутый","Есть опыт разработки 2D/3D игр, для PC, Oculus Qwest и мобильных устройств (iOS / Android). От концепции до публикации в сторы. Знаю ООП, паттерны, SOLID, GRASP, базовые структуры данных и алгоритмы, Zenject, Dotween, Leo ECS. Умею работать с git. Есть навыки построяния 3д уровней и создания катсцен при помощи CineMachine. Есть опыт с UI c применением паттернов MVP/MVA/PM. Примеры кода: https://github.com/NikitaUstinov092","Otus Unity Game Developer. Professional , Архитектура в разработке видеоигр; Санкт-Петербургский государственный университет, Санкт-Петербург Социологии , Экономическая социология; Unity Game Developer. Professional Otus","Русский — Родной, Английский — B2 — Средне-продвинутый",https://hh.ru/resume/78e5ea16000598f15a0039ed1f706938754644
Кандидат,Программист С#,Не указано,"Мужчина, 28 лет","Ростов-на-Дону , готов к переезду , готов к командировкам",Не указано,Опыт работы 7 лет 2 месяца,"Программист С# в Казенное предприятие Ростовской области ""Информационная база ЖКХ""","Разработка системы для контроля подведомственными организациями Министерство строительства и жилищно-коммунального хозяйства (Asp.net Core 6, PostgreSQL, Razor Pages + jQuery + Bootstrap); Api для контроля транзакций и завершенных операций вычислений, с целью пересчета неверных значений (Asp.net Core WebApi, MS SQL Server (написание скриптов и хранимых процедур)); Api для отправки уведомлений через соц. сети, мессенджеры и почтовые клиенты (Asp.net Core WebApi, PostgreSQL, RabbitMQ).","Ответственность, Расчетливость, Отзывчивость, Внимательность, Порядочность, Тактичность, Работа в команде, Управление проектами, PostgreSQL, ASP.NET, Базы данных, Веб-программирование, Entity Framework, MVC, СУБД, RabbitMQ, Ajax, jQuery, LINQ, REST, Design Patterns, MS Visual Studio, ASP.NET MVC, API, REST API, SOAP, JSON API, WPF, Техническая документация, Linux, Русский — Родной, Английский — B1 — Средний, Украинский — C1 — Продвинутый","Стремлюсь развиваться, как профессионал в области информационных технологий, а также параллельно прохожу заочное обучение в аспирантуре для достижения научных и профессиональных целей. Работаю на всех этапах разработки ПО: от определения требований и составления технического задания до внедрения и последующей поддержки позволило мне развить навыки, необходимые для успешного достижения целей проекта. Я всегда стремлюсь к индивидуальному и профессиональному развитию и открыт новым вызовам. Коммуникабельность помогает мне эффективно взаимодействовать с командой и достигать конкретных результатов. Технологический стек и инструменты: Языки: C#, С++, Java; Платформа .net: .net framework 3.5+, .net Core, .net 5, .net 6, Asp.net Core, MVC, Razor, Web API, EF, EF.Core, LINQ, SignalR, DI, WPF, WinForms; Web: HTML, CSS, Javascript, jQuery, Bootstrap; SQL базы данных: MSSQL, PostgreSQL, SQLite; NoSQL базы данных: Redis; Брокеры сообщений: RabbitMQ, Kafka (базовое понимание); Инструменты командной работы: Yandex.Tracker, JIRA, Git; Visual Studio, TFS, Gitlab CI, Docker; Технологии: OAuth, JWT, Postman, Telegram API, Swagger; Тестирование: MSTest, NUnit. Телеграм: https://t.me/LeonidFeshchuk","Южно-Российский государственный технический университет (Новочеркасский политехнический институт), Новочеркасск Информационных технологий и управления , Программная инженерия; Донецкий национальный технический университет, Донецк (Украина) Компьютерных информационных технологий и автоматики , Программная инженерия; Национальный технический университет Украины ""Киевский политехнический институт"", Киев Информатики и вычислительной техники , Математика. Компьютерные науки","Русский — Родной, Английский — B1 — Средний, Украинский — C1 — Продвинутый",https://hh.ru/resume/c2d77139000884a1040039ed1f574f4c334c77
Candidate,C# programmer,Не указано,"Male, 38 years","Ukhta , I want to relocate (Canada, Cyprus, Krasnodar Krai, Moscow) , prepared for occasional business trips",Не указано,Work experience 16 years 6 months,"Head of the Department of computing, information systems and technologies в Ukhta State Technical University","The management of the IT Department. Сhief editor of 2 scientific journals. Support of information system of evaluation for lecturers and students of the University. Courses: ""Information technology"", ""System software"", ""Mobile development"", ""Project management in IT"".","C#, Visual Studio C#, MS SQL Server, Azure, ASP.NET, .NET Framework, HTML, Unity, XAML, WPF, CSS, Time management, Process Modelling, Multithread Programming, Analysis, OOD, Russian — Native, English — B2 — Upper Intermediate",Не указано,"Ukhta State Technical University, Ukhta Institute of Economics, Management and Information Technologies , Economics and national economy management (by industries); Ukhta State Technical University, Ukhta Information technology faculty , Information systems and technology; Ukhta Industrial-Economic College Accountant , Accountant-economist; MBA City business school , Project management","Russian — Native, English — B2 — Upper Intermediate",https://hh.ru/resume/822aa5e10003e679ac0039ed1f393932494e35
Кандидат,Frontend-разработчик,160 000 ₽ на руки,"Мужчина, 29 лет","Краснодар , готов к переезду , готов к командировкам",Не указано,Опыт работы 6 лет,Frontend-разработчик в Smart Arcitects,- Разработка и поддержка клиентской части веб-приложения c использованием Javascript + Vue.js + Quasar. - Разрабатывал макросы для R7-office на Javascript - Писал запросы PostgreSQL,"Python, CSS, SQL, Sass, Boostrap4, HTML5, JavaScript, Git, PostgreSQL, ООП, VBA, VueJS, Pinia, Vite, Quasar, Английский язык, Макросы R7 Office, Русский — Родной, Английский — C1 — Продвинутый",Не указано,"Кубанский государственный университет, Краснодар Факультет компьютерных технологий и прикладной математики , Прикладная математика; Кубанский государственный университет, Краснодар Переводчик в профессиональной сфере; Кубанский государственный университет, Краснодар Факультет компьютерных технологий и прикладной математики , Прикладная математика и информатика","Русский — Родной, Английский — C1 — Продвинутый",https://hh.ru/resume/0d855a64000649d0350039ed1f675847424f6a
