ФИО,Желаемая должность,Зарплата,Личная информация,Местоположение,Занятость и график,Общий опыт,Последнее место работы,Обязанности,Ключевые навыки,Обо мне,Образование,Языки,Ссылка
Кандидат,Web - программист - разработчик C#,Не указано,"Мужчина, 29 лет","Воронеж , не готов к переезду , готов к редким командировкам",Не указано,Опыт работы 5 лет 10 месяцев,Программист-разработчик в Индивидуальное предпринимательство / частная практика / фриланс,Настройка и оптимизация работы программного обеспечения внутри корпоративной сети.,"C#, Razor, Blazor, MVC, MS Visual Studio, MS SQL, Git, Разработка ПО, HTML5, BEM, Bootstrap, API, JavaScript, MS SQL Server, WPF, Docker, SQL, CSS3, Atlassian Jira, Design Patterns, XML, REST, SPA, ASP.NET Core, REST API, Angular, JSON API, Микросервисная архитектура, Jira, ASP.NET, Русский — Родной, Английский — B2 — Средне-продвинутый","Готов приступить к работе над интересными задачами, способствующими развитию меня как специалиста.","Воронежский государственный университет, Воронеж Компьютерных наук , Информационные системы и технологии; Воронежский государственный университет, Воронеж Математический , Математика и компьютерные науки; Воронежский государственный университет, Воронеж Математический , Системный инженер; Профессиональная разработка отчетов в 1С 8.3 на Системе Компоновки Данных (СКД) Проект Курсы по 1С.РФ , Программист 1С; Профессионал 1С 1С , Разработчик","Русский — Родной, Английский — B2 — Средне-продвинутый",https://hh.ru/resume/ebe787f4000507b0c80039ed1f775456327036
Кандидат,Программист Unity C#,120 000 ₽ на руки,"Мужчина, 34 года","Москва , м. Рязанский проспект , не готов к переезду , не готов к командировкам",Не указано,Опыт работы 8 лет 2 месяца,Программист в Overmind,Работа над проектом Leage of Masters,"C#, Visual Studio C#, Unity, Blender 3D, Русский — Родной, Английский — B1 — Средний","Мой git https://github.com/AvramovDV МОИ ПРИЛОЖЕНИЯ Сделал пошаговую стратегию The Conquest на C# на движке Unity https://www.youtube.com/watch?v=9rYhe4Upot4 The Conquest это классическая пошаговая стратегия, сочетающая в себе стратегическую игру на глобальной карте и тактические бои на карте сражений. Мобильная версия Судоку. https://github.com/AvramovDV/Sudocu.git Далекий космос. Аркадная игра про полеты в космосе https://www.rustore.ru/catalog/app/com.Avramov.DistantSpace DurakGame. Классическая карточная игра Дурак. https://www.rustore.ru/catalog/app/com.Avramov.DurakGame УЧАСТВОВАЛ В РАЗРАБОТКЕ Прототип приложения для автосервисов: https://play.google.com/store/apps/details?id=com.XGameStudio.autoFavorit&hl=ru&gl=US Direct shot — многопользовательский шутер https://store.steampowered.com/app/1585660/DIRECT_shot/ Leage of masters - autochess для ПК и мобильных устройств https://store.steampowered.com/app/2808830/League_of_Masters_Auto_Chess/ О СЕБЕ Умею работать с игровым движком Unity, программирую на C# (IDE VisualStudio). Знаю основы трехмерного моделирования в Blender (моделирование, наложение текстур, риггинг, скининг, анимация). Есть опыт работы с 3Д математикой (векторы, лучи, матрицы, плоскости и пр.) Люблю компьютерные игры, считаю их формой современного искусства. Увлечен различными жанрами: шутеры, стратегии (пошаговые и в реальном времени), ролевые (разные), экшены, файтинги. В меньшей степени гонки и симуляторы. Черпаю вдохновение не только в играх, но и в кино и литературе. Сильно впечатлили произведения Майкла Салливана, Брендона Сандерсона, Джорджа Мартина, Терри Гудкайнда, Терри Пратчетта, Анджея Сапковского. Знаком со всеми этапами создания игрового контента от создания трехмерных моделей и их анимации до переноса в игровой движок, настройки ассетов, написания игровой логики. Есть желание поучаствовать в разработке игр любых жанров на различных платформах на движке Unity. ДОПОЛНИТЕЛЬНЫЙ ОПЫТ Писал приложения под Windows на C#. В аспирантуре разработал программу для визуализации данных с рентгеновских компьютерных томографов. ПЕРСОНАЛЬНЫЕ КАЧЕСТВА Легко усваиваю новые знания, интересуюсь современными технологиями. Коммуникабелен, спокоен, рассудителен. Признаю профессиональные авторитеты, не конфликтен, свои возражения тщательно аргументирую. Легко признаю свою неправоту, как только ее осознаю. ЛОКАЦИЯ Нахожусь вблизи станции метро Рязанский проспект. Готов работать в любой точке Москвы, желательно недалеко от метро. Звоните и пишите в любое время, буду рад обсудить работу над вашим проектом! ;)","Филиал Южно-Уральского государственного университета (Национального исследовательского университета), Кыштым Управление и информатика в технических системах","Русский — Родной, Английский — B1 — Средний",https://hh.ru/resume/b32532a100071749940039ed1f476274486d46
Кандидат,С# разработчик,Не указано,"Мужчина, 30 лет","Москва , м. Пятницкое шоссе , готов к переезду , готов к редким командировкам",Не указано,Опыт работы 8 лет 5 месяцев,Программист-разработчик в PIX robotix,Разработка продуктов входящих в состав платформы. Проектирование и разработка высокомасштабируемых решений. Рефакторинг и оптимизация. Наставничество.,"SQL, Английский язык, Работа в команде, Работа с большим объемом информации, Visual Studio C#, C#, Эксперт по поиску информации в интернете, LINQ, Regex, Postman, ООП, JSON API, Avalonia, ReactiveUI, WPF, .NET Core, Git, Взаимодействие с заказчиком, MVVM, Figma, Русский — Родной, Английский — B1 — Средний",Не указано,"Московский авиационный институт (национальный исследовательский университет), Москва Аэрокосмических конструкций, технологий и систем управления , Информатика и вычислительная техника","Русский — Родной, Английский — B1 — Средний",https://hh.ru/resume/331f3fe30005a6038b0039ed1f32616d77686f
Кандидат,.net разработчик,250 000 ₽ на руки,"Мужчина, Не указано","Новосибирск , м. Золотая нива , готов к переезду , готов к редким командировкам",Не указано,Опыт работы 5 лет 1 месяц,Бэкенд разработчик .NET в MoneyCat,"Разработка бэкенда для отдела рисков. Интеграция с API внешних и внутренних систем. Работа как с микросервисами так и с монолитом. Поддержка и рефакторинг легаси кода. Разработка ТЗ вместе с бизнес аналитиком. Написание документации для разработанных сервисов и фич. Создание gateway для внутренней системы приятия решений. Который забирет и хранит данные из множества источников. Создание микросервисов для нестандартных флоу взаимодествия внутренних/внешних систем. Работа с меняющимися бизнес требованиями. Написание интеграционных тестов. Работа с метриками Prometheus, OpenTelemetry, Grafana.","C#, HTML, ASP.NET, Entity Framework, LINQ, xUnit, SOLID, AsyncAPI, DDD, Чистая архитектура, RabbitMQ, Apache Kafka, ASP.NET Core, ORM, Redis, TypeScript, React, React Native, Angular, Unit Testing, PostgreSQL, MS SQL, MongoDB, Elasticsearch, Dapper, CI/CD, Docker, NLog, TDD, SQL, Русский — Родной, Английский — B2 — Средне-продвинутый","TG: @semkinstein Разрабатываю бэкенд на ASP.NET Core. Работал в разных командах, умею строить коммуникацию как с системным аналитиком, ПМом так и напрямую с заказчиком. Работаю с Postgre и MSSQL. Проектирую схемы БД, оптимизирую запросы. Умею выстраивать межсистемное взаимодействие, вести продукт от стадии проектирование до релиза. Проводил интеграцию со множеством API, синхронные, асинхронные, через вебхуки. Разрабатывал свои вместе с фронт командой. Работал по API First. Пишу документацию к коду, оставляю комментарии. Разбирал множество странных документаций от индийских сервисов до протоколов работы с CAN шиной строительной техники. Постоянно развиваюсь, изучаю новые технологии работаю на последней версии дотнета.","Сибирский государственный университет телекоммуникаций и информатики, Новосибирск МРМ , Информационные технологии в медиаиндустрии","Русский — Родной, Английский — B2 — Средне-продвинутый",https://hh.ru/resume/c1a9ebf200053c57050039ed1f587a74477343
Кандидат,FullStack-Разработчик,Не указано,"Мужчина, 25 лет","Москва , не готов к переезду , готов к командировкам",Не указано,Опыт работы 4 года 8 месяцев,"C#/.NET-разработчик в АО ""ИСА""",Разработка системы управления ML-моделям. Разработка и обучение моделей. Разработка программ для автоматизации обработки данных перед обучением,"SQL, Ответственность, C#, .NET Framework, WPF, MS SQL Server, ООП, MS SQL, Unity, PostgreSQL, ASP.NET, Управление проектами, AngularJS, .NET Core, Azure, Web-дизайн, HTML, JavaScript, CSS, Русский — Родной, Английский — B1 — Средний","Опыт работы в сфере коммерческих разработок (B2B сервисы) Победитель национального чемпионата профессионального мастерства WorldSkills Russia 2019 в компетенции ""Управление жизненным циклом производства/управление программой”. Сейчас занимаюсь подготовкой участников. Опыт работы экспертом - 4 года. Все 4 года - золото на национальном финале. Умею работать в команде. Имею опыт командной разработки через Azure DevOps. Быстро учусь и готов получить новые навыки, необходимые для качественного выполнения работы. Легко нахожу язык с новыми людьми.","Московский государственный университет им. М.В. Ломоносова, Москва Философский , Реклама и связи с общественностью; Колледж Царицыно Управления и информационных технологий , Разработчик мультимедийных и веб-приложений","Русский — Родной, Английский — B1 — Средний",https://hh.ru/resume/3d92717c000874814c0039ed1f6a546559684c
Кандидат,"Программист .NET, C#",210 ₽ на руки,"Женщина, 53 года","Сургут , готова к переезду , готова к редким командировкам",Не указано,Опыт работы 30 лет 2 месяца,Ведущий разработчик в ОМК ИТ,"-ASP.NET Core, JavaScript, LINQ, Razor, EF, xUnit -Битрикс -Системы управления версиями TFS, Git","Аналитическое мышление, Разработка ПО, Oracle Pl/SQL, JavaScript, SVN, ASP.NET, ORACLE, LINQ, IIS, C#, MS SQL Server, PostgreSQL, Entity Framework, Работа в команде, Организаторские навыки, asp.net c, TFS, Git, asp.net core, Visual Studio C#, Русский — Родной, Английский — A1 — Начальный","Коммуникабельна, легко обучаема. Предпочтительна работа удалено.","Томский политехнический университет АВТФ , Управление и информатика в технических системах.; Межотраслевой институт повышения квалификации кадров при Томском Политехническом университете. Менеджмент , Менеджер.; ОЧУ ДПО ""Специалист"" Учебно-научный центр МГТУ им. Н.Э. Баумана , Full - stack javascript - разработчик","Русский — Родной, Английский — A1 — Начальный",https://hh.ru/resume/e03481b80004162d4f0039ed1f3168634a7637
Candidate,C# Developer,5 000 $ in hand,"Male, 26 years","Moscow , willing to relocate , prepared for business trips",Не указано,Work experience 7 years 11 months,.NET Software Developer в Trainline,"Participated in the development of the commutes system, which allows customers to create repeating itineraries (i. e. they regularly travel from Sutton to London, and thus they don't want to purchase tickets every week). My job was to develop the commute disruption detection system with the dedicated team in order to ensure that our customers would be persistently informed lest a commute for a given day not be possible. Enhanced the ticket barcode generation system to support reliable, secure, and cutting-edge type of tickets, cooperating with the related teams.","Git, C#, Business English, ASP.NET, Unix, Couchbase, AWS, Microsoft Azure, PostgreSQL, SQL, REST, TeamCity, MS SQL, .NET 6, Docker, Kubernetes, Russian — Native, English — C2 — Proficiency, Spanish — A1 — Basic","I'm a passionate BE developer who works with C#/ASP.NET Core framework, PostgreSQL/Couchbase databases, and AWS. I know a wide range of .NET development aspects, my experience includes all the stages of the application development: from the prototype creation to the support stage on many platforms like Windows, Linux, etc. I'm a great team player and I really like to participate in complex projects, creating useful solutions for customers with an enormous dedication.",Gymnasium N3,"Russian — Native, English — C2 — Proficiency, Spanish — A1 — Basic",https://hh.ru/resume/c6807a7f000204007a0039ed1f6169716b6a74
Не указано,"Программист-разработчик (Java, Spring, C#, Asp.net core)",Не указано,"Мужчина, 34 года","Ростов-на-Дону , готов к переезду , готов к командировкам",Не указано,Опыт работы 4 года 7 месяцев,Backend-разработчик в Нанософт,"Разработка системы автоматизированного проектирования (САПР) nanocad. Основной проект - ПО для проектирования объектов инфраструктуры. Стек технологий: C#, С++\CLI, . Net6. Мои обязанности: - Разработка функций - Реализация классов оберток на С++\CLI - Интеграция C++ API в существующий программный продукт. - Доработка/исправление багов С++ legacy кода.","Spring Framework, Java, Visual Studio C#, ООП, Entity Framework, ASP.NET Core, HTML, CSS, MVC, ASP. NET, .NET Core, REST API, PostgreSQL, MS SQL Server, Программирование, Адаптивная верстка, Разработка ПО, SQL, С#, Русский — Родной, Английский — B2 — Средне-продвинутый","- Бэкенд разработчик на С# ,Java, немного C++, опыт реализации десктоп и клиент-серверных веб-приложений, высшее техническое образование. Навыки: - .net :С# , ASP .net Core, Web API, MVC, Entity Framework, C++\CLI - JDK: Java Core 17+, Spring Framework, JDBC, JPA, NHibernate, Spring Security, Thymleaf, tests MockMvc - ООП, PostgreSQL,REST, Microservices, Bootstrap, html, css, git, работа в команде Уровень английского языка - средний (High Intermediate) Личные качества: стремление к обучению и развитию Есть желание работать в команде разработчиков над интересными проектами, решать поставленные задачи и стремиться к повышению профессиональных навыков и квалификации. frsv.andrei1991@gmail.com","Московский государственный технический университет им. Н.Э. Баумана, Москва МТ-6 , Обработка металлов давлением, инженер; Java Developer: от hello world до собственного клиент-серверного приложения Сбер университет; Skillbox Skillbox , C# разработчик","Русский — Родной, Английский — B2 — Средне-продвинутый",https://hh.ru/resume/52d990f20007a3e3260039ed1f747651456166
Кандидат,C#/.NET-разработчик,Не указано,"Мужчина, Не указано","Москва , готов к переезду , готов к командировкам",Не указано,Опыт работы 2 года 8 месяцев,Стажер C# Разработчик в OZON Tech,Поддерживал веб-сервисы на ASP.NET и GRPC. Реализовывал асинхронность и многопоточность. Проводил интеграционное тестирование. Использовал PostgreSQL и Redis. Обеспечивал взаимодействие сервисов через Kafka.,"Git, PostgreSQL, C#, .NET Framework, .NET Core, Linux, Agile, MySQL, REST API, Redis, CI/CD, ASP.NET MVC, ADO.NET, Entity Framework, C/C++, ASP.NET Core + gRPC, Docker, Французский — Родной, Английский — C1 — Продвинутый, Русский — C2 — В совершенстве","Я окончил Московский энергетический институт (МЭИ) по специальности ""Информационная безопасность"" в 2022 году и в настоящее время обучаюсь в магистратуре по направлению ""Прикладная математика и информатика"" в Московском университете дружбы народов (РУДН). Кроме того, я являюсь студентом Школы 21, приуроченной к Сбербанку, где активно изучаю Backend Development с использованием .NET/C#.","Школа 21 Образовательный проект от Сбер для разработчиков , Программирование С/С++, С#, SQL, DevOps, Linux, Career Track; Российский экономический университет имени Г.В. Плеханова, Москва Цифровой менеджмент и предпринимательство , .; Российский университет дружбы народов Data science and Digital Transformation , .; НИУ Московский Энергетический Институт Информационная безопасность , .; Algorithms and Data Structures University, Courses , https://github.com/eliot-geek/Algorithms-and-Data-Structures; Веб-верстка (HTML, CSS) Базовое знание JavaScript SkillBox; Язык запроса SQL (MySQL) Skillbox , https://github.com/eliot-geek/SQL-Structured-Query-Language; Система контроля версий Git Skillbox; Объектно-Ориентированное Программирование GeekBrains , https://github.com/eliot-geek/Fundamentals-Of-Computer-Programming-With-CSharp; НИУ Московский Энергетический Институт МЭИ , Информационная безопасность; Разработчик С# Skillbox , https://github.com/eliot-geek/Profession-CSharp-Developer; Продвинутый уровень знания С# Skillbox , https://github.com/eliot-geek/Profession-CSharp-Developer; GeekBrains Geek , Основы программирования","Французский — Родной, Английский — C1 — Продвинутый, Русский — C2 — В совершенстве",https://hh.ru/resume/5b2cbdd200082d5b9f0039ed1f645654416835
